[
  {
    "claim_id": "CLM-0001",
    "claim": "Human brain function is distributed across interacting anatomical and functional systems; broad educational maps of brain regions are useful but do not by themselves explain or diagnose an individual person's cognition or behavior.",
    "domain": "foundational neuroscience",
    "study_path_tags": ["Human Operating Systems", "Research Literacy"],
    "population": "General human neuroscience education",
    "evidence_rating": "B",
    "evidence_basis": "Authoritative federal/public neuroscience education sources support broad brain organization; claim deliberately avoids fine-grained mechanistic or diagnostic inference.",
    "source_ids": ["SRC-0001", "SRC-0010"],
    "what_evidence_establishes": "Major brain structures and networks contribute to interacting sensory, motor, cognitive, regulatory, and physiological functions.",
    "what_evidence_does_not_establish": "A region-level educational description cannot determine why one individual behaves a certain way or establish a psychiatric or neurological diagnosis.",
    "risk_of_bias_notes": "These are educational overviews rather than systematic evidence syntheses.",
    "precision_notes": "No effect size is claimed.",
    "consistency_or_heterogeneity": "Broad anatomical-functional organization is well established; exact mappings depend on task, method, and level of analysis.",
    "contradictory_evidence": {"status": "not_searched", "notes": "Formal contradiction/supersession search pending human evidence review.", "source_ids": []},
    "applicability": "Suitable for HOSI systems-first orientation and neuroscience foundations, not individual-level interpretation.",
    "status": "source_matched",
    "reviewed_on": "2026-09-15",
    "reviewed_by": "ChatGPT metadata/claim drafting; human review pending",
    "human_reviewer": null,
    "revision_history": [{"date": "2026-09-15", "change": "Initial bounded claim card created from verified public-source metadata.", "by": "ChatGPT"}]
  },
  {
    "claim_id": "CLM-0002",
    "claim": "Sleep timing and sleepiness are influenced by interacting homeostatic sleep pressure and circadian timing processes, with light serving as an important circadian cue.",
    "domain": "sleep and circadian systems",
    "study_path_tags": ["Human Operating Systems", "Sleep Science"],
    "population": "General human sleep education",
    "evidence_rating": "A",
    "evidence_basis": "Current NHLBI educational guidance presents homeostatic sleep drive and circadian/body-clock processes as core contributors to sleep-wake timing.",
    "source_ids": ["SRC-0002"],
    "what_evidence_establishes": "Sleep-wake regulation reflects multiple interacting processes rather than a single willpower or motivation variable.",
    "what_evidence_does_not_establish": "This baseline model does not diagnose insomnia, circadian-rhythm disorders, bipolar disorder, ADHD, or any other condition in an individual.",
    "risk_of_bias_notes": "Authoritative educational guidance, not a claim-specific systematic review.",
    "precision_notes": "No individual prediction or treatment effect is claimed.",
    "consistency_or_heterogeneity": "The broad two-process framing is established, while individual timing varies with age, light exposure, behavior, health, and other factors.",
    "contradictory_evidence": {"status": "not_searched", "notes": "Dedicated supersession and mechanistic review search remains pending.", "source_ids": []},
    "applicability": "Appropriate for ordinary human-system baseline lessons on sleep, circadian timing, and social rhythms.",
    "status": "source_matched",
    "reviewed_on": "2026-09-15",
    "reviewed_by": "ChatGPT metadata/claim drafting; human review pending",
    "human_reviewer": null,
    "revision_history": [{"date": "2026-09-15", "change": "Initial bounded claim card created.", "by": "ChatGPT"}]
  },
  {
    "claim_id": "CLM-0003",
    "claim": "Cognitive behavioral therapy is an evidence-based psychotherapy option included in current clinical guidance for adults with major depressive disorder.",
    "domain": "cognitive and behavioral therapies",
    "study_path_tags": ["CBT", "Treatment Literacy"],
    "population": "Adults with major depressive disorder",
    "evidence_rating": "A",
    "evidence_basis": "Current VA/DoD major-depressive-disorder clinical guidance includes evidence-based psychotherapy, including CBT, within treatment options.",
    "source_ids": ["SRC-0003"],
    "what_evidence_establishes": "CBT is a guideline-supported psychotherapy option for the specified condition and population.",
    "what_evidence_does_not_establish": "The claim does not establish that CBT is superior to every alternative, effective for every individual, or transferable without condition-specific evidence to every HOSI study path.",
    "risk_of_bias_notes": "Guideline recommendations depend on the evidence review, values, feasibility, and the VA/DoD practice context.",
    "precision_notes": "This card records guideline inclusion, not a pooled treatment effect size.",
    "consistency_or_heterogeneity": "Treatment response varies among individuals and across interventions.",
    "contradictory_evidence": {"status": "not_searched", "notes": "Claim-specific comparison with newer systematic reviews remains pending.", "source_ids": []},
    "applicability": "Use for CBT treatment literacy in MDD examples; other diagnoses require their own evidence records.",
    "status": "source_matched",
    "reviewed_on": "2026-09-15",
    "reviewed_by": "ChatGPT metadata/claim drafting; human review pending",
    "human_reviewer": null,
    "revision_history": [{"date": "2026-09-15", "change": "Initial guideline-bounded CBT claim created.", "by": "ChatGPT"}]
  },
  {
    "claim_id": "CLM-0004",
    "claim": "Interpersonal and Social Rhythm Therapy has randomized-study evidence synthesized in a recent systematic review for people with bipolar disorder, but claim-level efficacy and comparative-effectiveness statements require full-text extraction and appraisal.",
    "domain": "IPSRT",
    "study_path_tags": ["Bipolar Studies", "IPSRT", "Social Rhythm"],
    "population": "People with bipolar disorder represented in the included IPSRT studies",
    "evidence_rating": "C",
    "evidence_basis": "A 2024 systematic review identifies randomized IPSRT evidence, but this MVP has verified metadata rather than completed full-text claim extraction.",
    "source_ids": ["SRC-0004"],
    "what_evidence_establishes": "A contemporary systematic-review evidence base exists for IPSRT in bipolar-disorder populations.",
    "what_evidence_does_not_establish": "This card does not establish a universal effect size, superiority to other therapies, efficacy in every bipolar phase, or benefit for every individual.",
    "risk_of_bias_notes": "Full-text extraction of study quality, comparators, sample sizes, and heterogeneity is still required.",
    "precision_notes": "No pooled numerical efficacy estimate is asserted in this MVP card.",
    "consistency_or_heterogeneity": "Pending full-text extraction from the systematic review and included studies.",
    "contradictory_evidence": {"status": "not_searched", "notes": "Newer reviews, trials, and guidelines still need a targeted contradiction search.", "source_ids": []},
    "applicability": "Supports inclusion of IPSRT as a serious evidence-literacy topic in HOSI, not a personal treatment recommendation.",
    "status": "source_matched",
    "reviewed_on": "2026-09-15",
    "reviewed_by": "ChatGPT metadata/claim drafting; human review pending",
    "human_reviewer": null,
    "revision_history": [{"date": "2026-09-15", "change": "Initial deliberately conservative IPSRT claim created pending full-text appraisal.", "by": "ChatGPT"}]
  },
  {
    "claim_id": "CLM-0005",
    "claim": "Current NICE bipolar-disorder guidance addresses assessment, psychological and pharmacological management, monitoring, crisis care, recovery, and shared decision-making rather than treating medication as the only meaningful treatment ingredient.",
    "domain": "bipolar treatment literacy",
    "study_path_tags": ["Bipolar I", "Bipolar II", "Treatment Literacy"],
    "population": "People covered by NICE bipolar-disorder guidance",
    "evidence_rating": "A",
    "evidence_basis": "Current NICE CG185 is an active clinical guideline with a 2025 update and multimodal scope.",
    "source_ids": ["SRC-0005"],
    "what_evidence_establishes": "A major current guideline treats bipolar care as multimodal and includes psychological, social, monitoring, crisis, recovery, and pharmacological considerations.",
    "what_evidence_does_not_establish": "It does not support blanket anti-medication messaging, individual medication changes, or the claim that every intervention has equal evidence.",
    "risk_of_bias_notes": "Guideline applies within NICE/UK context and contains recommendations originating from different evidence-review dates.",
    "precision_notes": "This is a scope/treatment-literacy claim, not a comparative efficacy estimate.",
    "consistency_or_heterogeneity": "Different interventions and phases of bipolar disorder have different evidence bases.",
    "contradictory_evidence": {"status": "not_searched", "notes": "Cross-guideline comparison and recommendation-level contradiction search pending.", "source_ids": []},
    "applicability": "Useful for HOSI pharmacology balance and treatment-literacy framing; individual care remains clinician/patient decision-making.",
    "status": "source_matched",
    "reviewed_on": "2026-09-15",
    "reviewed_by": "ChatGPT metadata/claim drafting; human review pending",
    "human_reviewer": null,
    "revision_history": [{"date": "2026-09-15", "change": "Initial bipolar treatment-literacy claim created.", "by": "ChatGPT"}]
  },
  {
    "claim_id": "CLM-0006",